Link,Abstrak,Author,Pub,Ed
detail.jsp?id=4687&lokasi=lokal,"Pada awal pengembangannya, pelatihan JNB-Fuzzy dengan Algoritma Genetika digunakan untuk melakukan optimasi terhadap struktur jaringan yang kompleks. Eksperiment lanjutan membuktikan bahwa hasil pengenalan dengan sistem ini memperlihatkan hasil yang tidak memuaskan. Fungsi evaluasi Algoritma Genetika yang digunakan pada sistem awal terlalu berorientasi pada pemotongan bobot. Akibat yang muncul dari aspek ini adalah tingkat pengenalan yang tidak memadai apabila digunakan ujicoba menggunakan data aroma 3 campuran 6 kategori keluaran. Perbaikan kemudian dilakukan pada fungsi evaluasi Algoritma Genetika ini dengan menambahkan satu variable, tambahan yaitu prosentase hasil pengenalan. Dengan komponen variabel ini pencarian alternatif solusi dengan Algoritma Genetika tidak hanya memperhitungkan efektifitas pengenalan terhadap data masukan. Pengembangan dengan tambahan fokus efektifitas pengenalan, telah memperlihatkan hasil yang memuaskan dengan rata-rata pengenalan 94.44; . Hanya saja, ujicoba tersebut hanya mempergunakan satu jenis data yaitu data aroma dengan 3 campuran dengan 6 kelas kategori pengenalan. Pada tugas akhir ini, dilakukan ujicoba terhadap JNB-Fuzzy yang dioptimasi pada  struktur jaringan dan prosentase pengenalan menggunakan data yang lebih kompleks,  yaitu data aroma 2 dan 3 campuran dengan kategori pengenalan sebesar 6,8,9 dan 12. Hasil uji coba ini memperlihatkan bahwa terjadi penurunan derajat pengenalan jaringan setiap kali jumlaah kategori keluaran diperbesar. Penurunan yang terjadi sangat besar berkisar antara 2-23; per kategori.","Hasan, Muhammad  "," Publisher: Depok: Fasilkom UI, 2002 Call Number: SK-0520 ",Benyamin Kusumoputro
detail.jsp?id=4666&lokasi=lokal,"Pengenalan  aroma dengan menggunakan jaringan neural buatan fuzzy learning vector qantization (JNB FLVQ)  telah terbukti menghasilkan pengenalan yang paling baik dibanding JNB yang lainnya. FLVQ juga telah terbukti (unkown). Sementara itu, JNB lainnya (sejauh ini) tidak ada yang melakukan pengenalan aroma lebih  baik dari ElVQ dan tidak mampu mengenali data unknown sebaiknya FLVQ.  Tujuan  penelitian ini adalah menguji metode FLVQ 16  sensor dalam mengenali aroma data dua campuran dan tiga campuran dengan menggunakan analisa matriks similaritas pada data yang tidak diketahui (unknown). Dengan meggunakan analisa matriks similatitas, kita dapat mengetahui pada epoch beberapa sistem mencapai tingkat pengenalan terbaik. Untuk data aroma dua campuran, sistem dapat dengan baik mengenali aroma tersebut. Sebaliknya untuk data aroma tiga campuran, sistem hanya berhasil mengenali dengan baik untuk kategori 6 dan 8 pola keluaran. Hal ini menunjukkan bahwa data aroma tiga campuran termasuk sangat sulit untuk dikenali.","Hidayat, Komara  "," Publisher: Depok: Fasilkom UI, 2002 Call Number: SK-0498 ",Benyamin Kusumoputro
detail.jsp?id=4504&lokasi=lokal,"Melamona mahgman adalah tumor kulit yang sangat ganas, sehingga diteksi sedini mungkin amat diperlukan. Ahli kulit percaya bahwa diagnosa tumor kulit berdasarkan ciri-ciri tertentu dapat digunakan untuk mendeteksi tumor lebih awal. Ciri-ciri tersebut diekstrak dari citra berwarna dan dimasukkan ke jaringan saraf tiruan untuk dikenali. Jaringan saraf yang digunakan dalam tugas akhir ini ialah jaringan saraf propagasi balik, dengan keluaran adalah jenis tumor (apakah tumor merupakan melanoma atau bukan). Untuk mempercepat waktu pelatihan jaringan, cross-entropy error function digunakan sebagai fungsi kesalahan, menggantikan quadratie error function yang lazim dipakai. Sebelum diproses oleh jaringan saraf, ciri-ciri dari tumor diproses dahulu dengan Principal Component Analysis (PCA). Tujuan utama dari PCA adalah reduksi dimensi data dengan masih mempertahankan informasi yang ada. Dengan adanya PCA, masukan ke jaringan saraf dapat diperkecil, sehingga kompleksitas jaringan dapat dikurangi.","Ariyanto, Aripin  "," Publisher: Depok: Fasilkom UI, 1997 Call Number: SK-0340 ",Benyamin Kusumoputro
detail.jsp?id=46137&lokasi=lokal,"Pengenalan Emosi Pada Gambar Menggunakan ResNet Manusiamampumengenaliobjekpadagambardenganmudah,tetapitugasinitidak mudah dilakukan untuk komputer. Pengenalan objek dalam gambar oleh komputer mendapatkan hasil terbaik menggunakan Deep Learning dengan arsitektur Convolutional Neural Network. Manusia juga meiliki reaksi emosional terhadap gambar yang diamati. Namun, reaksi emosional yang ditimbulkan bersifat subjektif, maka dataset yang conï¬dently labelled sulit didapatkan. Sedangkan, penggunaan Deep Learning membutuhkan data yang besar. Selain itu, dalam melakukan pengenalan emosi visual juga terdapat bermacam rangsangan visual yang dapat mempengaruhi emosi manusia dari warna, tekstur, hingga isi objek dalam gambar. Penelitian ini mencoba mengatasi masalah tersebut dengan mengimplementasikan dan menganalisis metode Transfer Learning dari dataset besar seperti ImageNet. Penulis juga mengeksplorasi cara mengatasi ketidakseimbangan kelas pada dataset emosi yang digunakan, melihat hasil ï¬ne-tuning parameter di beberapa bagian pretrained network, menguji penggunaan regularisasi pada network, dan memanfaatkan ï¬tur spesiï¬k dan ï¬tur umum yang didapatkan dari Transfer Learning menggunakan metode ensemble dalam melakukan pengenalan emosi visual. Hasil penelitian ini menunjukan ï¬tur umum (low-level feature) dan ï¬tur spesiï¬k (high-level feature) yang didapatkan dari pengenalan objek ImageNet dapat ditransfer atau dimanfaatkan dengan baik untuk pengenalan emosi visual.",Azmi  ," Publisher: Depok: Fakultas Ilmu Komputer Universitas Indonesia, 2018 Call Number: SK-1614 (Softcopy SK-1096) Source Code-653 ",Dina Chahyati
detail.jsp?id=44326&lokasi=lokal,"Pengenalan Entitas Kesehatan pada Forum Kesehatan Online dengan Menggunakan Recurrent Neural Networks Saat ini, seseorang dapat memanfaatkan forum kesehatan online untuk mencari tahu perihal penyakit tanpa perlu tatap muka dengan dokter. Melalui forum tersebut, seseorang hanya perlu menuliskan keluhan dan pertanyaan pada formulir yang tersedia. Banyak sekali informasi bermanfaat yang dapat diperoleh dari forum tersebut seperti keluhan, obat atau langkah penyembuhan. Penelitian ini mencoba untuk melakukan ekstraksi entitas disease, symptom, treatment dan drug secara otomatis. Penulis memandang permasalahan ini sebagai permasalahan sequence labeling sehingga penulis mengusulkan penggunaan teknik Deep Learning dengan menggunakan Recurrent Neural Networks (RNNs), karena RNNs merupakan stateof- the-art untuk permasalahan sequence labeling. Penulis mengusulkan fitur kata itu sendiri, kamus kesehatan, stop word, POS-Tag, frasa kata (nomina dan verba), kata sebelum dan kata sesudah. Selain itu penulis juga mengusulkan dua arsitektur RNNs, yaitu LSTMs 1 layer dan LSTMs 2 layer multi-input. Hasil eksperimen menunjukkan bawah model yang diusulkan mampu memberikan hasil yang cukup baik. Berdasarkan eksperimen dengan kombinasi fitur kata itu sendiri, kamus kesehatan, stop word, frasa kata (nomina dan verba), 1 kata sebelum dan 1 kata sesudah dengan arsitektur LSTMs 1 layer mampu mencapai rata-rata f-measure 63:06% dan LSTMs 2 layer mampu menghasilkan rata-rata f-measure 62:14%. Hasil tersebut lebih baik dibandingkan dengan baseline yang digunakan, yaitu penelitian Herwando (2016) dengan f-measure 54:09%.",Wahid Nur Rohman  ," Publisher: Depok: Fakultas Ilmu Komputer UI, 2017 Call Number: SK-1506 (Softcopy SK-988) Source Code SK-611 ",Mirna Adriani
detail.jsp?id=4630&lokasi=lokal,"Jaringan syaraf tiruan banyak digunakan pada aplikasi pengenalan pola, di antaranya untuk pengenalan objek 3 dimensi. Metode pengenalan objek 3 dimensi melalui citra 2 dimensi dari berbagai sudut pandang telah dikembangkan dengan cara memodifikasi arsitektur lapis tersembunyi pada jaringan multi-layer perceptron menjadi bentuk silindaris dengan menggunakan metode pelatihan propagasi balik yang dikenal dengan Cylindrical  Hidden Multi-Layer Percpetron Back Propagation (CHMLP-BP). Metode ini melibatkan  pasangan berarah antra ventor sudut pandang terhadap objek dengan vektor posisi neuron pada lapis tersebunyi yang diabstraksikan ke dalam konstata yang akan berperan dalam  proses pelatihan maupun penganalan. Pengembangan lebih lanjut pada CHMLP-BP ini adalah memodifikasi arsitektur sub lapis tersembunyi darai bentuk silindris menjadi konsentris dan mengganti fungsi kesalahan Mean Sqauare Error menjadi Cross Entropy. Karena struktur jaringan yang didapatkan dari pengembangan ini tidak optimal, maka dilakukan optimasi struktur  jaringan dengan menggunakan Algoritma Genetika sehingga diperoleh struktur jaringan yang optimal dengan tingkat pengenalan yang lebih tinggi. CHMLP-BP hanya dapat digunakan untuk mengenali objek 3 dimensi dari sudut  pandang horizontal saja. Karena itu pengenalan objek 3 dimensi dari sudut pandang vertikal-horizontal membutuhkan arsitektur JST yang baru. Berdasarkan arsitektur CHMLP-BP, dikembangkan Hemisphere Strukture of Hidden Layer (HSHL) untuk mengenali objek 3  dimensi dengan sudut  pandang vertikal-horizontal. Modifikasi dilakukan dengan mengubah bentuk sub lapis tersembunyi dari lingkaran menjadi setengah bola. Hal ini melibatkan pengubahan pasangan berarah yang digunakan. Pada CHMLP-BP, pasangan berarah mempresentasikan vektor pada ruang dua dimensi. Sedangkan pada HSHL mempresentasikan vektor pada ruang tiga dimensi. Karena itu rumus yang digunakan pada CHMLP-BP berbeda dengan HSHL. Pada dasarnya HSHL merupakan jaringan multi-layer perceptron yang menggunakan metode pelatihan propagasi dengan fungsi kesalahan cross entropy. Selain bentuk dasar HSHL tunggal dikembangkan pada HSHL jamak yang setiap sub lapis tersembunyinya terdiri dari beberapa lapis setengah bola dengan pusat sama.Pada eksperimen objek 3 dimensi sudut pandang vertikal-horizontal dilakukan desain eksperimen yang menggunakan konsep percentage of learning/testing paragigm yaitu perancangan eksperimen yang dibedakan menurut perbandingan antara data pelatihan dan pengujian. Sedangkan untuk eksperimen pengenalan objek 3 dimensi dari arah horizontal digunakan rancangan eksperimen yang dibuat oleh Renny. Hasil eksperimen menunjukkan bahwa HSHL tunggal mempunyai kemampuan yang terbaik dalam pengenalan objek 3 dimensi baik dari sudut pandang horizontal maupun vertikal-horizontal. Kemampuan pengenalan objek 3 dimensi sudut pandang horizontal yang tertinggi adalah 94, 4%. Hasil eksperimen juga menunjukkan bahwa dengan menggunakan prosentase data pelatihan sebesar 47 % pada arsitektur HSHL  Tunggal dan jenis jaringan multiplied akan didapatkan pengenalan objek 3 dimensi sudut pandang vertikal-horizontal sebesar 84, 87%","Maulana, Galuh Dian  "," Publisher: Depok: Fasilkom UI, 2001 Call Number: SK-0461 ",Benyamin Kusumoputro
detail.jsp?id=4629&lokasi=lokal,"Untuk pengenalan objek 3 dimensi telah dikembangkan jaringan syaraf tiruan hemisphere Structure of hidden layer (JST HSHL) yang dapat mengenali objek 3 dimensi melalui data citra 2 dimensi yang diambil dari sudut pandang horisontal dan vertikal. JST HSHL mempunyai arsitektur sub lapir tersembunyi berbentuk setengah bola yang menggabungkan informasi sudut pandang vertikal dan  horisontal. JST HSHL menggunakan metode pembelajaran supervised yang  mempunyai pola target tertentu yang menjadi acuan keberhasilan pembelajaran serta menggunakan metode pelatihan Back Propagation (propagasi balik) dengan fungsi kesahan Cross Entropy. Untuk mengenali objek 3 dimensi dari kumpulan citra 2 dimensi, JST HSHL menggunakan pasangan berarah vektor sudut pandang dan vektor posisi. Vektor sudut pandang menunjukkan arah dan sudut pandang kamera ke pusat sebuah objek 3 dimensi dan vektor posisi menunjukkan poisi neuron terhadap pusat suatu setengah bola yang membentuk satu sub lapis tersembunyi. Data citra 2 dimensi yang digunakan pada pengenalan objek 3 dimensi menggunakan JST HSHL ini merupakan  data spasial yang mempunyai dimensi data citra yang besar. Dimensi data citra yang besar dapat menurunkan kinerja pengenalan  objek 3 dimensi dengan JST HSHL. Untk itu diperlukan pemrosesan awal  (preprocessing) pada data citra tersebut untuk mengurangi dimensi data citra yang digunakan. Reduksi dimensi citra dilakukan dengan mengekstrak ciri yang dimiliki oleh citra 2 dimensi tersebut melalui transformasi Karhunen-Loeve atau Principal Component Analysis (PCA). Data citra hasil reduksi ini merupakan data citra yang berada  di ruang eigen atau eigen space. Dalam penelitian ini digunakan 3 jenis metode reduksi yang menggunakan transformasi Karhunen-Loeve yaitu metode Eigen Parsial 1, Eigen Parsial 2 dan Eigen semua. Pada metode Eigen Partial 1, data citra dikelompokkan sesuai dengan sudut pandang horisontal yang dimiliki dan akan dilakukan trasformasi Karhunen-Loeve terhadap masing-masing kelompok tersebut. Metode Eigen parsial 2 akan melakukan proses transformasi  Karhunen-Loeve pda kelompok data citra  yang memiliki 2 sudut horisontal yang berdekatan dan data citra yang memiliki sudut diantara 2 tersebut akan menggunakan transformasi Karhunen-Loeve yang telah dihasilkan oleh proses sebelumnya. Untuk metode Eigen Semua, data citra tidak dikelompokkan, sehingga seluruh data citra yang digunakan akan mengalami reduksi dimensi citra menggunakan transformasi Karhunen-karhunen secara bersama-sama.  Percobaan dilakukan dengan menggunakan dua arsitektur jaringan yang berbeda yaitu tunggal dan jamak. Untuk masing-masing arsitektur ini digunakan 2  tipe jaringan yaitu normal dan multiple. Tipe jaringan multiple memiliki jumlah neuron 2 kali lebih banyak dari tipe jaringan normal. Hasil pengenalan objek 3  dimensi dengan menggunakan data citra 2 dimensi yang berada dalam ruang eigen mempunyai tingkat pengenalan yang memuaskan. Hasil pengenalan maksimal untuk 4  buah objek 3 dimensi mencapai 98,66% untuk data eigen yang dihasilkan dari metode Eigen parsial 2 dengan menggunakan arsitektur jaringan tunggal dan tipe jaringan normal.",Yanuarisa Kariani  ," Publisher: Depok: Fasilkom UI, 2001 Call Number: SK-0460 (Source Code SK-45) ",Benyamin Kusumoputro
detail.jsp?id=4576&lokasi=lokal,"Sistem jaringan saraf tiruan telah banyak mengalami perkembangan sesuai dengan domain permasalahannya masing-masing. Dalam bidang pengenalan objek 3 dimensi telah dikembangkan sistem jaringan clyndrical Hidden Multi-Layer Perceptron Back Propagation (CHMLP-BP-Konsentris. Jaringan CHMLP-BP konsentris ini melakukan pengenalan objek 3 dimensi melalui citra 2 dimensi dari berbagai sudut pandang. Penelitian yang telah dilakukan sebelumnya hanya pada objek 3 dimensi sederhana. Oleh karena itu dalam penelitian ini jaringan CHMLP-BP konsentri akan dilihat kinerjanya terhadap objek wajah 3 dimensi. Wajah, sebagai salah satu objek 3 dimensi, memiliki kompleksitas yang cukup tinggi. Hal ini terutama dengan kemampuan wajah untuk berekpresi sehingga menimbulkan adanya vasiasi terhadap objek. Dalam penelitian ini jaringan CHMLP-BP konsentri akan digabungkan dengan metode eigenfaces, untuk dapat meningkatkan kinerja dalam hal pengenalan wajah 3 dimensi. Metode eigenfaces adalah suatu tehnik reduksi data masukan dengan kemampuan untuk menyimpan ciri-ciri yang diperlukan saja. Metode eigenfaces ini  telah banyak dipergunakan dalam bidang pengenalan wajah secara 2 dimensi. Selanjutnya akan diadakan perbandingan untuk melihat apakah metode eigenfaces mampu meningkatkan kinerja CHMLP-BP konsentris, dalam pengenalan objek wajah secara 3 dimensi. Dalam penelitian ini akan diperlihatkan bahwa dengan digunakannya metode eigenfaces untuk reduksi data masukan, ternyata kinerja CHMLP-BP konsentris dapat meningkatkan baik dari segi pengenalan maupun segi waktu pelatihan","Amudi, Johanes  "," Publisher: Depok : Fasilkom UI, 2000 Call Number: SK-0420(Source Code SK-26) ",Benyamin Kusumoputro
detail.jsp?id=4573&lokasi=lokal,"Dalam bidang pengenalan objek 3 dimensi telah dikembangkan sistem jaringan saraf tiruan Cylindrical Hidden Multi-Layer Perceptron Back Propragation (CHMLP-BP) jaringan CHMLP-BP ini melakukan pengenalan objek 3 dimensi melalui data citra 2 dimensi yang diambil dari berbagai sudut pandang pengamatan terhadap objek. Peningkatan kinerja sistem CHMLP-BP telah dilakukan dengan memodifikasi beberapa formula pembelajaran dan struktur jaringan. Modifikasi dilakukan dengan menambah mode pemroses pada sub lapis tersembunyi secara acak serta modifikasi arsitektur lapis tersembunyi dari bentuk silinder tunggal menjadi bentuk konsentris sehingga disebut CHMLP-BP konsentris. Walaupun kinerja meningkat, pertambahan node pada lapis tersembunyi secara acak belum membuktikan bahwa struktur jaringan telah optimal. Salah satu metode pencarian bentuk struktur jaringan yang optimal dan dapat menemukan solusi global terbaik adalah algoritma genetika. Penerapan algoritma genetika berguna untuk merduksi ukuran jaringan dengan membuang node-node pemroses yang tidak diperlukan [SULI99]. Penelitian yang telah dilakukan sebelum diterapkan pada objek 3 dimensi sederhana. Pada penelitian ini sistem jaringan CHMLP-BP konsentris yang dioptimasi dengan algoritma genetika diterapkan untuk pengenalan objek wajah 3 dimensi.Objek wajah 3 dimensi memiliki kompleksitas yang cukup tinggi, terutama dengan kemampuan wajah untuk berkspersi sehingga menimbulkan adanya variasi terhadap objek . Data citra wajah yang diperoleh dari pengamatan berbagai sudut pandang terhadap objek wajah 3 dimensi ini perlu melalui tahap pre-processing untuk mereduksi ukuran dimensi data agar dapat meningkatkan kinerja  jaringan. Metode yang digunakan untuk mereduksi dimensi tanpa adanya ciri data yang hilang adalah metode fisherface [BELH97]. Metode Fisherface dapat mengenali wajah, baik untuk berbagai variasi cahaya dan berbagai ekpresi wajah.","Panggabean, Martha Yuliana  "," Publisher: Depok: Fasilkom UI, 2000 Call Number: SK-0416 (Source Code SK-22) ",Benyamin Kusumoputro
detail.jsp?id=4660&lokasi=lokal,"Jaringan syaraf  Tiruan (JST) merupakan salah satu pendekatan yang sering digunakan dalam mengenali objek wajah manusia. Metode pengenalan objek wajah 3  dimensi citra wajah 2 dimensi dari berbagai sudut pandang telah dikembangkan dengan cara memodifikasi arsitektur lapis tersembunyi pada jaringan mlti-layer perceptron menjadi bentuk silindris menggunakan metode pelatihan propagasi balik. Metode pengenalan ini dikenal dengan nama Cylindrical Hidden Multi-Layer Perception Back Propagation (CHMLP-BP). Pengembangan lebih lanjut terhadap CHMLP-BP adalah memodifikasi arsitektur sub lapis tersembunyi dari bentuk silindris menjadi konsentris dan mengganti fungsi kesalahan dari Mean Square Error menjadi Cross Entropy. Karena struktur jaringan yang didapatkan dari pengembangan ini besar datn tidak optimal, maka dilakukan optimasi struktur jaringan dengan menggunakan Algoritma Genetika sehingga diperoleh struktur jaringan yang lebih optimal. Salah satu kendala dari pengenalan objek wajah 3 dimensi yang telah dilakukan adalah kurang terstandarisarinya citra wajah yang digunakan dan adanya informasi latar belakang diluar bagian-bagian penting wajah yang ingin dikenali. Hal ini  mendasari ide untuk menerapkan metode cropping untuk mereduksi citra sehingga lebih terstandarisasi, dan mengambil bagian-bagian citra yang mengandung informasi yang diperlukan bagi pengenalan. Namun karena metode cropping yang sudah ada hanya terbatas pada citra wajah frontal dan tidak dapat mengakomodasi perubahan sudut pandang, maka dalam penelitian ini dikembangkan metode cropping yang dapat mengakomodasi perubahan sudut pandang citra. Pada penelitian ini",Sri Ayu Lestari  ," Publisher: Depok: Fasilkom UI, 2002 Call Number: SK-0492 (Source Code SK-66) ",Benyamin Kusumoputro
detail.jsp?id=4636&lokasi=lokal,"Salah satu tujuan dari penelitian Jaringan Saraf Tiruan adalah untuk meningkatkan kemampuan pengenalan serta mempercepat waktu pelatihan jaringan. Untuk mencapai hal tersebut, salah satu pemikiran  yang muncul adalah  mengkombinasikan dua tipe pelatihan pada jaringan saraf tiruan yaitu pelatihan dengan pengarahan dan pelatihan tanpa pengarahan. Pelatihan dengan pengarahan adalahpelatihan yang mempunyai kemampuan generalisasi yang baik dan waktu pelatihan yang singkat. Salah satu jaringan saraf yang mengkombinasikan dua tipe pelatihan ini  adalah jaringan saraf hibrida PB-SKNC. Dalam jaringan saraf PB-SKNC ini, jaringan saraf  swa-organisasi dalam proses pelatihannya, menggunakan tabel sejarah kemenangan neuron cluster. Berdasarkan tabel ini, akan dihapus neuro cluster yang memiliki probabilitas kemenangan rendah serta akan dibentuk neuron cluster yang memiliki probalitas kemenangan rendah serta akan dibentuk neuron cluster yang memiliki probalibilitas kemenangan rendah serta akan dibentuk neuron cluster yang memiliki probabilitas kemenangan tinggi. Dengan ini diharapkan semua neuron cluster akan dapat merepresentasikan data masukan dengan baik. Jika neuron cluster dapat merepresentasikan data masukan data masukan dengan baik, maka proses pelatihan dengan  pengarahan yaitu dengan menggunakan pelatihan propagasi balik, akan dapat berjalan dengan lebih singkat. Jaringan saraf hibrida PB-SKNC digunakan untuk melakukan pengenalan terhadap data aroma. Data aroma yang digunakan terdiri dari dari 2 macam yaitu data aroma 2 dan data aroma 3 campuran. Aroma 2  campuran terdiri dari 3 jenis aroma jeruk, kenanga dan mawar yang masing-masing  dicampur dengan beberapa tingkat kadar alkohol. Aroma 3 campuran terdiri dari aroma jeruk-kenanga, jeruk-mawar, serta mawar kenanga yang masing-masing dicampur dengan beberapa tingkat kadar alkohol. Setiap kadar akohol dalam masing-masing campuran aroma  menentukan pola dari aroma. Agar jaringan saraf PB-SKNC dapat berfungsi secara optimal maka diperlukan parameter pelatihan yang tepat. Penentuan parameter yang tepat didasarkan pada percobaan-percobaan yang dilakukan pada jaraingan, karena belum ada rumusan yang baku mengenai penentuan parameter untuk pelatihan jaringan saraf PB-SKNC. Dari percobaan-percobaan yang dilakukan pula dapat diketahui bahwa jaringan hibrida PB-SKNC dapat mengenali data aroma 2 campuran dengan baik. Namun untuk data aroma 3 campuran jaringan hibrida PB-SKNC tidak dapat mengenalinya dengan baik. Dapat diketahui pula bahwa kemampuan pengenalan jaringan juga tergantung pada jumlah pola yang harus dikenal dan jumlah sensor yang digunakan. Semakin banyak sensor yang digunakan dan semakin sedikit pula  yang harus dikenali umumnya hasilnya akan makin baik pula.",Chafid Ahmad  , Publisher:  Call Number: SK-0467(Source Code SK-47) ,Benyamin Kusumoputro
detail.jsp?id=4544&lokasi=lokal,"Sistem pengenal huruf tulisa tangan didasarkan pada penggunaan jaringan neural buatan metode propagasi balik, logika fuzzy dan teknik pengolahan citra. Huruf tulisan tangan dianggap sebagai graph berarah (directed graph) yang mempunyai kumpulan titik awal atau akhir dan titik cabang dan rusuk (edge). Rusuk ini dapat diklasifikasikan sebagai garis lurus, kurva dan loop dengan menggunakan logika fuzzy. Teknik pengolahan citra yang digunakan dalam sistem ini adalah algoritma penipisan untuk mendapatkan kerangka dari suatu bentuk dan algoritma aproksimasi kerangka untuk menghilangkan efek yang mungkin ditimbulkan akibat proses penipisan, sehingga didapatkan informasi struktural yang sesuai dari bentuk semula. Sistem ini terdiri dari tiga tahap utama. Tahap pertama adalah pra-pengolahan untuk mendapatkan kerangka huruf. Tahap kedua adalah membuat graph berarah dari kerangka yang dihasilkan. Elemen dasar seperti garis, kurva dan loop diekstrak dari graph dan menggunakan logika fuzzy untuk mengklasifikasikan jenis elemen tersebut. Tahap akhir adalah jaringan neural propagasi balik digunakan untuk klasifikasi huruf. Sistem ini telah diuji dengan data yang tidak dilatih dan mendapatkan hasil yang cukup memuaskan dengan presentase pengenalan terendah adalah 71.15; dan tertinggi adalah 84.62; .","Philipus D, Emanuel  "," Publisher: Depok: Fasilkom UI, 1998 Call Number: SK-0384 ",Benyamin Kusumoputro
detail.jsp?id=44970&lokasi=lokal,"Penggunaan Mobile Learning dalam Memperkaya Proses Belajar di Luar Kelas pada Tingkat Sekolah Menengah Atas: Studi Kasus Aplikasi Ruangguru dan Line Academy Penelitian ini bertujuan untuk menganalisis faktor-faktor penerimaan dan harapan pengguna, baik pengajar dan murid, sebagai bahan evaluasi terhadap implementasi mobile learning. Objek penelitian ini adalah Ruangguru.com dengan layanannya berupa aplikasi Ruangguru dan Line Academy. Faktor-faktor ditinjau dari studi penelitian sebelumnya dan diuji melalui pendekatan kualitatif dan kuantitatif. Data kuantitatif diperoleh dari hasil kuesioner kepada murid dan dianalisis dengan menggunakan metode Entropy untuk mengetahui bobot dari masing-masing faktor, sedangkan data kualitatif dianalisis berdasarkan hasil wawancara dengan pengajar dan manajemen Ruangguru.com. Penelitian ini menunjukkan bahwa guru dan murid sepakat nilai mobilitas menjadi faktor utama yang memengaruhi penggunaan aplikasi Ruangguru dan Line Academy. Faktor lainnya adalah sikap menggunakan teknologi, gaya pembelajaran, informasi yang tersedia, fasilitas yang mendukung, niat penggunaan, kemudahan penggunaan, kesenangan pengguna, manfaat yang dirasakan, inisiatif, kemampuan individu, dan pengaruh sosial.",Dini Seprilia  ," Publisher: Depok: Fakultas Ilmu Komputer, 2017 Call Number: SK-1531 (Softcopy SK-1013) ",Putu Wuri Handayani
