Link,Abstrak,Author,Pub,Ed
detail.jsp?id=4580&lokasi=lokal,"Transformasi wavelet packet adalah generalisasi dari transformasi wavelet, dimana pemfilteran ketingkat resolusi yang lebih rendah tidak hanya dilakukan pada koefisien aproksimasi, tetapi juda terhadap koefisien detail. Algoritma piramida dari transformasi wavelet packet membentuk tree yang lengkap. dari Tree yang  lengkap ini dapat dibentuk suatu best tree yang entropi Shannonn-nya minimal. Dalam tugas akhir ini dikembangkan perangkat lunak dengan bahasa MATLAB dan C aygn mengimplementasikan pemampatan citra dengan trasformasi wavelet packet dan pembuatan best tree menggunakan entropi Shannon. Perangkat lunak ini dugunakanuntuk mengamati sifat transformasi wavelet packet dan pengaruh pemilihan leaf dan best tree terhadap rasio pemampatan danmutu visual citra. Hasil ujicoba menunjukkan bahwa trasformasi wavelet packet memiliki kelebihan dibandingkan dengan transformasi wavelet, terutama dari segi pemilihan koefisien yang akan disimpan dalam kaitannya dengan mutu visual dan rasio pemempatan citra. Kekurangan dari transformasi wavelet packet adalam kompeksitasnya, sehingga waktu yang dibutuhkan untuk melakukan keseluruhan proses lebih lambat dibandingkan dengan transformasi wavelet.",Rusdiana  ," Publisher: Depok: Fasilkom UI, 2000 Call Number: SK-0424 ",Yohanes Stefanus
detail.jsp?id=4497&lokasi=lokal,"Wavelet merupakan sejenis fungsi yang dapat digunakan sebagai basis representasi fungsi lain. Fungsi wavelet sendiri diturunkan dari sebuah scaling function dengan bantuan konsep dilasi dan translasi. Transformasi wavelet merupakan proses proyeksi sebuah fungsi terhadap basis fungsi wavelet. Transformasi wavelet meiliki sifat-sifat multiresolusi yang memungkinkan representasi suatu citra dijital dalam basis wavelet sangat cocok untuk dimampatkan dengan mutu visual citra yang dapat diatur. Pada penelitian ini dikembangkan suatu perangkat lunak berbasis bahasa Java yang mengimplementasikan pemampatan citra dengan transformasi wavelet. Perangkat lunak ini menjadi landasan ujicoba untuk mengamai sifat-sifat pemampatan citra dengan transformasi wavelet. Ujicoba yang dilakukan pada penelitian ini menunjukkan bahwa pemampatan citra dengan transformasi wavelet memberikan hasil yang cukup memuaskan, baik dari segi kinerja, rasio pemampatan, maupun mutu visual.","Manurung, Hisar Maruli  "," Publisher: Depok: Fasilkom UI, 1997 Call Number: SK-0333 ",Yohanes Stefanus
detail.jsp?id=4546&lokasi=lokal,"Agar memiliki kinerja yang baik, pemeriksa ejaan elektronis memerlukan kamus kata dengan kinerja yang baik pula Kamus kata yang telah dikembangkan sebelum penelitian ini menggunakan model trie dan memiliki kinerja yang cukup baik. Meskipun demikian model tersebut masih memiliki kelemahan dan dapat dikembangkan lebih lanjut. Tugas akhir ini meneliti kemungkinan penggunaan model Directed Acylic Word-Graph (DAWG) sebagai model kamus kata pengganti trie. Penelitian difokuskan pada analisis kinerja kedua model dan isu-isu pengimplementasian dalam pembutan kamus model DAWG. Hasil uji coba dapat menunjukkan kelebihan DAWG. Dengan menggunakan struktur data untuk elemen kamus dan algoritme pencarian kata yang sama dengan trie. dipastikan kinerja pencarian kata pada DAWG sama dengan trie, yang dalam penelitian sebelumnya terbukti baik. Kelemahan pada trie, yaitu besarnya ruang penyimpanan yang diperlukan, juga dapat diatasi dengan model DAWG, yang memiliki tingkat pemamptan tinggi, Ukuran berkas kamus dalam bentuk DAWG hanya 50; dari berkas kamus trie dan 80; dari berkas masukan. yaitu daftar kata dalam representasi ASCII-nya. Dapat disimpulkan DAWG merupakan model yang tepat untuk menggantikan trie sebagai kamus kata pemeriksa ejaan.","Dharma, Renatha B.  "," Publisher: Depok Fasilkom UI, 1998 Call Number: SK-0377 ",Bobby Nazief
detail.jsp?id=45745&lokasi=lokal,"Pembangunan Awal Model Ekstraksi Leksikon Bilingual Indonesia-Inggris    Seiring berkembangnya teknologi, penggunaan bahasa pun turut berkembang dengan adanya penambahan kosakata baru. Hal ini menyebabkan kamus yang ada terus perlu diperbarui. Bilingual lexicon extraction dilakukan dengan tujuan memperoleh pasangan kata dalam dua bahasa. Pada penelitian ini, model ektraksi leksikon bilingual Indonesia Â– Inggris dibangun dengan memanfaatkan word embedding dikombinasikan dengan informasi morfologi dan distribusi kata dalam masing-masing bahasa. Model morfologi dan distribusi kata mempertimbangkan kata yang identik dalam kedua bahasa, kata serapan yang diturunkan dari sejumlah aturan, kata yang memiliki bentuk yang berdekatan, dan kata dengan frekuensi yang hampir sama. Dalam penelitian ini, empat parameter didefinisikan terkait model word embedding untuk ekstraksi yaitu validasi pada pasang kata training, arti tunggal pada pasang kata training, filter jenis kata pada pasang kata training, dan menggunakan post-filtering setelah testing. Hasil terbaik model ekstraksi leksikon dari bahasa Inggris ke bahasa Indonesia mencapai presisi sebesar 51%, sedangkan presisi model untuk ekstraksi dari bahasa Indonesia ke bahasa Inggris sebesar 57%.",Muhammad Iddad Izzatulummah  ," Publisher: Depok : Fak. Ilmu Komputer, 2017 Call Number: SK-1593 (Softcopy SK-1075) Source Code SK-651 ",Rahmat Mahendra
detail.jsp?id=46156&lokasi=lokal,"Pembangunan Knowledge Base melalui Pendekatan Ekstraksi Informasi dengan Studi Kasus Warisan Budaya    Warisan budaya dan sejarah alam perlu dilestarikan. Salah satu upaya yang dapat diimplementasikan adalah dengan memanfaatkan teknologi informasi melakukan otomatisasi ekstraksi entitas warisan budaya dari teks guna membangun knowledge base yang dapat digunakan untuk manajemen pengetahuan mengenai warisan budaya. Pada penelitian ini artikel-artikel Wikipedia mengenai provinsi dan kabupaten/kota di Indonesia dijadikan sebagai sumber ekstraksi dengan total artikel yang diekstrak, yaitu 34 artikel provinsi dan 515 artikel kabupaten/kota. Proses ekstraksi dibagi menjadi tiga, yaitu ekstraksi tabel, ekstraksi daftar, dan ekstraksi teks bebas. Pada akhir penelitian, terekstrak sebanyak 4425 entitas warisan budaya yang dikategorikan ke dalam 33 kategori. Dengan menggunakan gold standard yang dibentuk secara manual dari artikel-artikel mengenai provinsi di Indonesia, didapatkan precision sebesar 0,84 dan recall sebesar 0,62. Hal tersebut menunjukkan bahwa teknik yang dikembangkan untuk melakukan ekstraksi data memiliki potensi yang cukup baik untuk membangun knowledge base mengenai warisan budaya.",Hadi Syah Putra  ," Publisher: Depok: Fakultas Ilmu Komputer Universitas Indonesia, 2018 Call Number: SK-1645 (Softcopy SK-658) ",Rahmat Mahendra
detail.jsp?id=44974&lokasi=lokal,"Pembangunan Korpus Pasangan Kata Relasi Hipernim- Hiponim Bahasa Indonesia Menggunakan Pendekatan Pattern Analysis Word relation extraction adalah salah satu penelitian di bidang NLP yang bertujuan untuk mengekstrak kata berdasarkan relasi yang didefinisikan. Korpus pasangan kata relasi dibutuhkan untuk menunjang berbagai penelitian selanjutnya. Korpus tersebut umumnya disimpan dalam kamus digital seperti WordNet Bahasa Inggris. Sayangnya untuk Bahasa Indonesia masih banyak kekurangannya. Penelitian ini dilakukan dengan tujuan membangun korpus pasangan kata relasi secara otomatis. Penelitian lain yang sama telah dilakukan dengan berbagai cara. Pendekatan yang dipilih untuk digunakan dalam penelitian ini adalah menggunakan pattern extraction dan pattern matching. Pembangunan korpus sendiri dilakukan secara bertahap dengan metode semi-supervised learning. Relasi yang diteliti adalah relasi semantik hipernim-hiponim dengan menggunakan Wikipedia sebagai data sumber. Pada akhir penelitian, terbentuk korpus dengan total paling banyak 3493 pasangan kata. Akurasi untuk setiap eksperimen yang diujikan selalu lebih besar dari 0.8. Hal tersebut menunjukkan bahwa penggunaan metode pattern analysis dengan data Wikipedia memiliki potensi untuk menghasilkan data berukuran besar dan berkualitas baik.",Made Nindyatama Nityasya  ," Publisher: Depok: Fakultas Ilmu Komputer, 2017 Call Number: SK-1545 (Softcopy SK-1027) Source Code SK-1027 ",Mirna Adriani
detail.jsp?id=45734&lokasi=lokal,"Pembangunan Trust Model untuk Menilai Trust Merchant di Media Sosial Twitter    Trust merupakan aspek penting dalam aktivitas berbelanja di media sosial. Media sosial memberikan informasi yang bebas sehingga sulit untuk mengidentifikasi kebenaran atau tingkat kepercayaan penjual. Variabel penentu trust sangat banyak dan dipengaruhi oleh banyak faktor. Pada penelitian ini penulis membangun trust model untuk menilai trust merchant yang ada di media sosial. Penulis membangun trust model dengan melihat entitas yang ada pada media sosial Twitter. Penulis melihat konten, jenis interkasi fitur twitter yang customer lakukan ketika menghubungi merchant, merchant preliminary score yang dilihat dari jumlah followers dan lists memberships.  Hasil trust model yang dibangun oleh penulis divalidasi dengan membandingkan penilaian merchant trust yang dilakukan oleh manusia.",Rafikatiwi Nur Pujiarti  ," Publisher: Depok : Fak. Ilmu Komputer, 2017 Call Number: SK-1587 (Softcopy 1069) Source Code SK-649 ",Satrio Baskoro Yudhoatmojo
detail.jsp?id=44285&lokasi=lokal,"Pembentukan Otomatis Aplikasi Berbasis Web dengan Masukan Berupa Ontologi: Studi Kasus Web BSMI Pada saat ini, kebutuhan untuk dapat membentuk sebuah aplikasi berbasis web sangatlah tinggi. Akan tetapi, pembentukan sebuah aplikasi berbasis web masih tergolong sulit untuk organisasi yang tidak memiliki tenaga teknis. Di sisi lain, ontologi merupakan salah satu komponen dari web semantik yang masih dikembangkan sampai saat ini. Penggunaaannya masih sangat minim karena dirasa hanya akan menambah kesulitan dalam proses pembuatan aplikasi berbasis web. Dari permasalahan tersebut maka penelitian ini bertujuan untuk membentuk sebuah sistem yang dapat membentuk aplikasi berbasis web secara otomatis dengan masukan berupa ontologi. Penelitian ini membahas bagaimana sebuah aplikasi berbasis web dapat dibentuk menggunakan masukan berupa ontologi. Tahapan utama dari penelitian ini adalah desain sistem dan implementasi tranlasi elemen ontologi ke dalam sistem Zotonic. Kemudian pembentukan business logic yang didapatkan dari ontologi yang dibuat juga dibahas pada penelitian ini.",Bravyto Takwa Pangukir  ," Publisher: Depok: Fakultas Ilmu Komputer UI, 2017 Call Number: SK-1510 (Softcopy SK-992) Source Code SK-613 ",Ade Azurat
detail.jsp?id=4516&lokasi=lokal,"Pesatnya perkembangan internet di Indonesia menimbulkan permintaan akan domain internet dari organisasi-organisasi Indonesia yang berkeinginan untuk mempunyai domain sendiri. Saat ini karena jaringan internet sudah berskala global, kewenangan pemberian domain internet dilakukan berdasarkan jurisdiksi organisasional atau negara. Untuk Indonesia, organisasi yang berwenang dalam memberikan dan mendelegasikan domain akan disebut sebagai Pengelola Domain Internet Indonesia. Dalam melaksanakan proses registerasi domain, pengelola berencana membuat aplikasi yang menggunakan pendekatan otomasi alur tugas (workflow), yang akan diimplementasikan di atas basis internet. Dari studi kasus pembuatan program prototipe, dapat disimpulkan bahwa proses registerasi domain merupakan proses yang sesuai jika dilaksanakan oleh keompok kerja yang terdiri atas anggota-anggota dengan klasifikasi kemampuan dan otoritas yang berbeda","Santosa, Andi  "," Publisher: Depok: Fasilkom UI, 1997 Call Number: SK-0353 ",Johny Moningka
detail.jsp?id=43492&lokasi=lokal,"Pemenuhan Kepuasan dari Keikutsertaan Konsumen Menjadi Brand Follower pada Twitter dan Dampaknya terhadap Brand Relationship Quality serta Keinginan Konsumen untuk Melakukan Electronic Word-of-Mouth Tingginya pengguna internet saat ini memicu perusahaan untuk menggunakan strategi pemasaran produk baru dengan memanfaatkan internet. Salah satu strategi pemasaran produk tersebut adalah electronic word-of-mouth (eWOM). eWOM sendiri merupakan suatu komunikasi antar pelanggan yang membicarakan mengenai produk atau jasa dari suatu merk. Penelitian ini bertujuan untuk menganalisis pengaruh dari pemenuhan kepuasan yang diterima konsumen dengan menjadi brand follower pada Twitter terhadap brand relationship quality (BRQ) dan dampaknya terhadap terhadap keinginan seseorang untuk melakukan eWOM. Penelitian ini menggunakan stimulus-organism-response (S-O-R) framework sebagai kerangka dalam menyusun model penelitian. Uses and Gratification Theory (UGT) digunakan sebagai antecedent dari BRQ. Dengan menyebarkan kuesioner secara online melalui media sosial (Twitter, Facebook, Line, dan Whatsapp), didapatkan 725 responden. Data yang didapatkan kemudian dianalisis dengan metode structural equation modelling (SEM) dan dibantu dengan software AMOS 22. Dari hasi analisis data, ditemukan bahwa terdapat 4 faktor pemenuhan kepuasan yang mempengaruhi BRQ, yaitu social interaction, network externality, reward seeking, dan content consumption. Semua faktor memiliki pengaruh yang lemah kecuali social interaction. Selain itu, juga ditemukan bahwa BRQ memiliki pengaruh yang kuat terhadap tiga aktivitas eWOM yang meliputi opinion seeking, opinion giving, dan opinion passing.",William Suwignyo  ," Publisher: Depok: Fakultas Ilmu Komputer UI, 2016 Call Number: SK-1435 (Softcopy SK-917) ",Achmad Nizar Hidayanto
detail.jsp?id=4662&lokasi=lokal,"Tujuan penelitian ini adalah suatu aplikasi yang membantu memeriksa dan menilai abstrak berbahasa Indonesia. Aplikasi ini memberikan saran penilaian suatu abstrak masukan dengan memperhatikan kandungan informasi yang terdapat pada abstrak. Penilaian pada penelitian ini dibatasi hanya pada keberadaan informasi seperti tujuan, metode, hasil/ kesimpulan dan ruang lingkup. Dalam mencari informasi dalam abstrak aplikasi ini menggunakan teknik-teknik dalam pemrosesan bahasa alami yaitu sistem ekstrasi informasi dan pengurai bahasa alami. Penelitian ini mengimplementasikan metode CIRCUS pada sistem ekstraksi dan constraint-based fromalism pada pengurai kalimat. Dalam uji coba menggunakan abstrak mahasiswa Fakultas Ilmu Komputer, aplikasi menunjukkan 4 abstrak dinilai diterima dan 96 abstrak dinilai ditolak. Uji coba pada abstrak yang mengalami pembetulan kalimat aplikasi menunjukkan 9 abstrak dinilai diterima dan 91 abstrak dinilai ditolak, yang merupakan hasil yang sama dengan penilaian yang dilakukan secara manual. Pengembangan aplikasi ini selanjutnya direkomendasikan meneliti hubungan antar kalimat dan hubungan antar paragraf sebagai sumber penilaian, selain inforamsi yang terkandung pada abstrak.",Luthfy Andriansyah  ," Publisher: Depok: Fasilkom UI, 2002 Call Number: SK-0494 (Source Code SK-67) ",Bobby Nazief
detail.jsp?id=46144&lokasi=lokal,"Pemeringkatan Faktor-Faktor Penerimaan Financial Technology Jenis Electronic Wallet dan Digital Cash di Indonesia    Financial Technology (FinTech) kategori payment terdiri dari dua jenis berdasarkan karekteristiknya, yaitu yang berbentuk kartu (electronic wallet) dan yang berbasis aplikasi (digital cash). Terdapat begitu banyak tantangan untuk menjadikan masyarakat menengah ke bawah sebagai segmen pasar fintech jenis electronic wallet ataupun digital cash. Namun, masih terdapat dari mereka yang menggunakannya. Untuk itu, harus ada pengkajian khusus mengenai faktor apa yang paling penting bagi mereka untuk menerimanya sebagai alat pembayaran. Oleh karena itu, ditetapkan pemeringkatan kepentingan dari masing-masing faktor yang dapat memengaruhi penerimaan pengguna terhadap electronic wallet dan digital cash sebagai tujuan penelitian ini.    Pencarian literatur pada penelitian ini dilakukan dengan metode SLR. Setelah melalui beberapa tahap eliminasi, didapatkan 10 literatur dengan rinciannya yaitu 4 dari Proquest, 1 dari Springer Link, 3 dari Scopus, dan 2 dari Science Direct. Selanjutnya, literatur-literatur tersebut diekstraksi dan disintesis hingga menghasilkan faktor-faktor penerimaan dalam bentuk struktur hierarki dengan penentuan tingkatan yang masih subjektif.    Melalui penilaian dari dua ahli di bidang teknologi finansial, struktur hierarki menjadi tervalidasi. Struktur tersebut disebut struktur hierarki AHP yang kemudian diolah menjadi kuesioner yang diisi oleh 6 responden. Melalui perhitungan rata-rata geometris dan perhitungan nilai eigen yang dilakukan menggunakan bantuan dari aplikasi Expert Choice 11, didapatkan 2 faktor penerimaan yang paling penting terhadap fintech kategori sistem pembayaran jenis electronic wallet adalah ease of use dan speed; sedangkan pada jenis digital cash adalah ease of use dan cost-benefit.",Muthia Nabila  ," Publisher: Depok: Fakultas Ilmu Komputer Universitas Indonesia, 2018 Call Number: SK-1621 (Softcopy SK-1103) ",Betty Purwandari
detail.jsp?id=4529&lokasi=lokal,"Dalam implementasi komputerisasi Kamus Besar Bahasa Indonesia(KBBI) terdapat masalah kebutuhan penyimpanan disk yang relatif besar. Salah satu cara pemecahannya adalah menggunakan kompresi data. KBBI memiliki bentuk dan besar data yang sangat beragam untuk tiap entrinya. Oleh karena itu digunakan basis data tekstual yang mempunyai ciri khas variable-length field (panjang field yang bervariasi), yang cocok untuk karakteristik data KBBI. Untuk implementasi kompresi terhadap data KBBI dipilih 3 algoritme kompresi yaitu Huffman, Aritmetic, dan Lempel-Ziv 78. Namun kompresi data yang dilakukan perlu memperhatikan kebutuhan KBBI yaitu pencarian kembali hanya sebagian kecil data dan waktu akses yang harus cepat. Untuk itu juga dirancanga strategi-strategi kompresi terhadap data KBBI. Strategi I mengkompresi keseluruhan berkas data, strategi II membagi berkas data dalam blok-blok kecil yang besarnya sama, dan strategi III membagi berkas data sesuai data sesuai dengan banyaknya data tiap entri. Untuk mencari bagaimana kompresi data yang terbaik untuk KBBI, dilakukan uji coba dengan mengimplementasikan algoritme-algoritme dan strategi-strategi kompresi diatas dan kemudian mengukur kinerjanya berupa rasio kompresi dan kecepatan eksekusinya. Dari pengukuran dan pengamatan terhadap ukuran kinerja semua kombinasi strategi dan algoritme dapat dipilih strategi dan algoritme pemampatan data teks untuk KBBI.",Ian Aditya Agus  ," Publisher: Depok: Fasilkom UI, 1997 Call Number: SK-0369 ",Bobby Nazief
detail.jsp?id=41959&lokasi=lokal,"Pemodelan Arsitektur Teknologi Sistem Informasi Manajemen Rumah Sakit dengan Menggunakan Tahapan The Open Group Architecture Framework (TOGAF): Studi Kasus RSUP Persahabatan Kegiatan pelayanan rumah sakit dapat terbantu dengan adanya sistem informasi manajemen rumah sakit (SIMRS). Pada tahun 2013 Kementerian Kesehatan RI sudah mengeluarkan suatu package aplikasi SIMRS yang bersifat open source. Akan tetapi belum ada panduan proses bisnis yang jelas untuk mengimplementasikan package tersebut. Oleh karena itu tujuan dari penelitian ini ialah untuk mengembangkan arsitektur SIMRS berdasarkan studi kasus RSUP Persahabatan, yang nantinya dapat dijadikan acuan dalam mengimplementasikan SIMRS. Penelitian ini dilaksanakan dengan menggunakan pendekatan kualitatif studi kasus, dan menggunakan teori pendukung The Open Group Architecture Framework Architecture Development Method (TOGAF ADM). Hasil penelitian ini berupa artefak yang menggambarkan arsitektur dari empat domain, yaitu bisnis, data, aplikasi, dan teknologi.",Rizky Amalia Kurnia  ," Publisher: Depok : Fakultas Ilmu Komputer, 2014 Call Number: SK-1268 (SOFTCOPY SK-749) ",Puspa Indahati Sandhyaduhita
detail.jsp?id=4689&lokasi=lokal,"L-system memungkinkan kompleksitas alam dapat didefinisikan dengan beberapa parameter dan aturan. Hal ini disebabkan L-System memanfaatkan tingkat kemiripan terhadap dirinya sendiri (self-similarity) yang sangat besar (OSC99]. Tugas akhir ini bertujuan untuk memodelkan bentuk-bentuk daun dengan menggunakan L-Systems, dan mendapatkan pola dari aturan-aturan yang membentuk jenis daun berikut, yaitu daun helai sederhana dan daun dengan helai seperti ""jari"" Untk menghasilkan suatu bentuk daun dengan L-Systems digunakan metode penggambaran surfaces. Salah satunya adalah metode developmental surfaces yang menggunakan produksi dan turgle graphics untuk menggambarkan bentuk daun. Implementasi dari aplikasi ini menggunakan bahasa pemrograman Java yang dilengkapi dengan Java 3D API untuk menvisualisasikan daun.","Pratiwi, Kiki  "," Publisher: Depok: Fasilkom UI, 2003 Call Number: SK-0522(Scan SK-2) ",Suryana Setiawan
detail.jsp?id=46163&lokasi=lokal,"Pemodelan Desain Aplikasi Software Product Line Menggunakan IFML (Interaction Flow Modeling Language):  Studi Kasus Organisasi Kemanusian (AISCO)        Kombinasi fitur dalam sebuah aplikasi SPLE menyebabkan variasi dalam user interface. Hal ini menyebabkan dibutuhkannya user interface yang adaptif dengan tiap konfigurasi fitur yang dipilih. IFML (Interaction Flow Modeling Language) merupakan modeling language dari OMG (Object Management Group) yang digunakan untuk memodelkan user interface serta user interaction suatu aplikasi. Dengan menggunakan IFML sebagai modeling language, akan dibuat sebuah abstract UI model yang akan digunakan untuk memodelkan tiap fitur pada aplikasi SPLE. Penelitian ini menggunakan AISCO (Adaptive Information System for Charity Organizations) sebagai studi kasus nyata. Penelitian ini bertujuan untuk menganalisis pemodelan aplikasi SPLE menggunakan abstract model dan hubungan antara SPLE dengan IFML. Hasil dari penelitian ini adalah abstract UI model yang dapat adaptif dengan konfigurasi fitur.",Siti Ina Sakinah  ," Publisher: Depok: Fakultas Ilmu Komputer Universitas Indonesia, 2018 Call Number: SK-1640 (Softcopy SK-1122) ",Ade Azurat
detail.jsp?id=46155&lokasi=lokal,"PemodelanPenalaranManusiadalamPemrogramanLogika Menggunakan Weak Completion Semantics dan Implementasinya Pemodelan penalaran manusia secara komputasional merupakan penelitian yang masih terus berkembang. Tugas akhir ini membahas pemodelan penalaran manusia berbasiskan pemrograman logika menggunakan sebuah semantik yang disebut Weak Completion Semantics. Weak Completion Semantics merupakan semantik program logika dengan tiga nilai kebenaran, berbasiskan Åukasiewicz Logic, yang mendukung penalaran non-monoton. Pendekatan ini telah diterapkan untuk memodelkanberbagaipermasalahanpenalaranmanusiayangmelibatkanpenalaran abduction seperti suppression task dan selection task. Dalam tugas akhir ini, sebuah sistem untuk abduction berbasiskan Weak Completion Semantics diimplementasikan dalam XSB Prolog. Sistem tersebut, TABDUAL+WCS, dikembangkan dari prototipe tabled abduction TABDUAL+ sebagai dasarnya. TABDUAL+WCS telah diuji melalui sejumlah eksperimen dan berhasil memodelkan penalaran manusia padapermasalahansuppressiontask danselectiontask,mendukunghasilpenelitian empirik di bidang psikologi.",Muhammad Zaky Khairuddin  ," Publisher: Depok: Fakultas Ilmu Komputer Universitas Indonesia, 2018 Call Number: SK-1644 (Softcopy SK-1126) Source Code SK-657 ",Ari Saptawijaya
detail.jsp?id=46159&lokasi=lokal,"Pemodelan Perilaku Jangka Panjang Niat Penggunaan Aplikasi     Komik Web: Perspektif Uses and Gratification Theory dan     Expanded Expectancy-Confirmation Model    Penelitian ini mengembangkan konsep expectancy-confirmation model (ECM) dengan mengadopsi perceived enjoyment dan pemenuhan kebutuhan (gratification) pengguna sebagai motivasi internal niat perilaku jangka panjang pengguna dalam menggunakan aplikasi komik web. Penelitian ini ingin memahami bagaimana pengaruh pemenuhan kebutuhan dan konfirmasi atas ekspektasi pengguna terhadap niat untuk menggunakan kembali aplikasi komik web secara berkelanjutan melalui kepuasan pengguna, kegunaan aplikasi yang dirasakan pengguna, dan perasaan kesenangan saat menggunakan aplikasi tersebut. Penelitian ini juga ingin mengetahui pengaruh faktor niat penggunaan kembali, perasaan kegunaan, dan perasaan kesenangan saat menggunakan aplikasi terhadap kesediaannya untuk membayar layanan premium pada aplikasi. Jenis pemenuhan kebutuhan yang dipakai dalam penelitian ini adalah pemenuhan kebutuhan hedonis yang terdiri dari fantasi dan pelarian diri dari kenyataan, sosial yang terdiri dari interaksi sosial dan identifikasi sosial, serta manfaat yang terdiri fungsionalitas dan kenyamanan saat menggunakan aplikasi. Pada penelitian ini diperoleh 652 responden yang merupakan pengguna aplikasi LINE Webtoon di Indonesia. Data dianalisis dengan menggunakan teknik statistik persamaan model struktural (SEM) dengan perangkat bantu SmartPLS 3.0. Hasil dari penelitian ini menyimpulkan bahwa pemenuhan kebutuhan hedonis dan manfaat dengan bantuan konfirmasi atas ekspektasi pengguna memiliki pengaruh positif secara signifikan terhadap perasaan kegunaan dan perasaan kesenangan saat menggunakan aplikasi. Sementara itu kebutuhan sosial ternyata tidak memberikan efek yang signifikan terhadap perasaan kegunaan dan perasaan kesenangan sebagai faktor afektif oleh karena kegiatan membaca komik dipandang sebagai kegiatan hiburan yang dinikmati sendirian. Konfirmasi atas ekspektasi juga ikut menyebabkan seseorang merasa puas saat menggunakan aplikasi komik web sehingga dia ingin menggunakan kembali aplikasi tersebut. Kemudian, perasaan kegunaan, perasaan kesenangan, dan kepuasan berpengaruh terhadap niat pengguna untuk menggunakan kembali aplikasi komik web. Hasil dari penelitian juga menyimpulkan bahwa hanya pengguna yang ingin terus menggunakan aplikasi yang bersedia untuk membayar demi menikmati layanan premium atau penawaran dalam aplikasi jika ada. Baik perasaan kegunaan atau perasaan kesenangan tidak berdampak langsung terhadap kesediaan pengguna untuk membayar layanan dalam aplikasi.",Johanes Iman Anugrah  ," Publisher: Depok : Fakultas Ilmu Komputer Universitas Indonesia, 2018 Call Number: SK-1634 (Softcopy SK-116) ",Achmad Nizar Hidayanto
